{
  "artifactType": "PROJECT_REALITY_REPORT",
  "schemaVersion": "1.0",
  "projectId": "mcf-v1.1",
  "revisionId": "prr-001",
  "methodologyPin": {
    "version": "1.1.0",
    "immutableRef": "git:5dc055cb7d402e5774b40b82723a8f008cd00e80"
  },
  "createdAt": "2026-08-15T12:00:00Z",
  "baseline": {
    "repository": "leon337/multiagent-collaboration-framework",
    "commitSha": "5dc055cb7d402e5774b40b82723a8f008cd00e80",
    "branch": "planning/mcf-v1.1-preimplementation-conformance",
    "capturedAt": "2026-08-15T12:00:00Z"
  },
  "observations": [
    {
      "observationId": "obs-001",
      "domain": "contracts",
      "statement": "The v1.0 mission contract exists in the shared contracts package.",
      "kind": "FACT",
      "evidenceRefs": [
        "apps/rede-social-agentes/packages/contracts/src/mcf-runtime.ts"
      ],
      "provenance": [
        {
          "type": "MACHINE_EVIDENCE",
          "sourceRef": "git:5dc055cb7d402e5774b40b82723a8f008cd00e80",
          "capturedAt": "2026-08-15T12:00:00Z",
          "actor": "CODEX_LOCAL"
        }
      ]
    }
  ],
  "unresolvedFacts": [],
  "realityConfirmation": {
    "status": "PENDING"
  },
  "contentDigest": "sha256:bbbbbbbbbbbbbbbbbbbbbbbbbbbbbbbbbbbbbbbbbbbbbbbbbbbbbbbbbbbbbbbb"
}
